{
  "$formspecResponseActions": "1.0",
  "version": "1.0.0",
  "targetDefinition": {
    "url": "https://example.gov/forms/regeneration-merge-base",
    "compatibleVersions": ">=1.0.0 <2.0.0"
  },
  "actions": [
    {
      "id": "submitApplication",
      "intent": "submit",
      "effects": [
        {
          "type": "hostEvent",
          "eventName": "formspec-submit"
        }
      ]
    }
  ]
}
